{
  "snapshot": {
    "bundleHealth": "valid",
    "freshnessStatus": "fresh",
    "warnings": [],
    "errors": [],
    "lastReconciled": "2026-03-20T02:37:04.000Z"
  },
  "context": {
    "declaredProfile": "greenfield",
    "requiredProfile": "greenfield",
    "authorityTier": "promoted",
    "requestedOperation": "action"
  },
  "decision": {
    "eligibility": "action_ready",
    "admitted": true,
    "freshnessClass": "current",
    "requiredAcknowledgement": false,
    "blockingReasons": [],
    "advisories": [],
    "preconditions": []
  },
  "summary": "Action is permitted under the current kernel admission state.",
  "readyForAction": true,
  "requiresAcknowledgement": false,
  "blocking": false
}
